{
  "id": "bldg-3f2b4c5d",
  "name": "Cesena Campus",
  "rooms": [
    {
      "id": "room-aula-magna",
      "name": "Aula Magna",
      "capacity": 220.0,
      "position": { "x": 12.5, "y": 0.0, "z": -4.25 },
      "dimensions": { "width": 18.0, "height": 6.5, "depth": 24.0 },
      "color": "#8ab4f8"
    },
    {
      "id": "room-lab-2",
      "name": "Lab 2",
      "capacity": 30.0,
      "position": { "x": -6.0, "y": 3.2, "z": 8.0 },
      "dimensions": { "width": 9.0, "height": 3.2, "depth": 12.0 }
    }
  ],
  "domains": ["unibo", "eng.unibo"]
}
